{
  "id": "section.cta.agent-promo",
  "registryId": "section.cta.agent-promo",
  "typeId": "cta.agent-promo",
  "version": "1.1.0",
  "category": "conversion",
  "semantic": {
    "id": "semantic.cta.agent-promo",
    "category": "conversion"
  },
  "source": {
    "id": "source.spec.t1.promo",
    "tag": "measured-spec",
    "citation": "spec.t1.promo",
    "file": "specs/content.md",
    "lines": "85-100"
  },
  "retrievalEligible": true,
  "purpose": "Cross-sell conversion row: eyebrow/H2/body + 'Learn more' CTA left, chat card (homepage v1 copy, lowercase) right; rows reveal individually on scroll. Classed as conversion (it exists to send the visitor to the agent product), not as a feature.",
  "evidenceLevel": "measured",
  "variants": {
    "insights": "Text 544 + card 640x810."
  },
  "composes": [
    "component.chat-mock",
    "primitive.text",
    "primitive.button"
  ],
  "contentModel": {
    "type": "object",
    "properties": {
      "eyebrow": {
        "type": "string",
        "maxWords": 4
      },
      "heading": {
        "type": "string",
        "maxWords": 8
      },
      "body": {
        "type": "string",
        "maxWords": 25
      },
      "cta": {
        "type": "object",
        "properties": {
          "label": {
            "type": "string",
            "maxWords": 4
          },
          "href": {
            "type": "string",
            "pattern": "^(/[a-z0-9/#-]*|#[a-z0-9-]+|https://[a-zA-Z0-9.-]+(/[^\\s]*)?|mailto:[a-z.]+@siena\\.cx)$"
          },
          "style": {
            "enum": [
              "xlg-dark"
            ]
          }
        },
        "required": [
          "label",
          "href",
          "style"
        ],
        "additionalProperties": false
      },
      "chat": {
        "type": "array",
        "items": {
          "type": "object",
          "properties": {
            "speaker": {
              "enum": [
                "customer",
                "siena"
              ]
            },
            "text": {
              "type": "string",
              "maxWords": 35
            }
          },
          "required": [
            "speaker",
            "text"
          ],
          "additionalProperties": false
        },
        "minItems": 3,
        "maxItems": 7
      },
      "background": {
        "type": "object",
        "properties": {
          "assetRole": {
            "const": "image.card-background"
          },
          "assetRef": {
            "type": "string",
            "pattern": "^(assets|svg|lottie|video)/[A-Za-z0-9._-]+$"
          },
          "alt": {
            "type": "string",
            "maxWords": 24
          }
        },
        "required": [
          "assetRole",
          "assetRef"
        ],
        "additionalProperties": false
      }
    },
    "required": [
      "eyebrow",
      "heading",
      "body",
      "cta",
      "chat",
      "background"
    ],
    "additionalProperties": false
  },
  "motion": {
    "allowedPatterns": [
      "chat-stagger"
    ],
    "reducedMotionFallbackRequired": true,
    "allowedFields": [
      "pattern",
      "reducedMotionFallback",
      "delayMs"
    ]
  },
  "responsive": [
    {
      "at": "{foundation.breakpoint.phone-max}",
      "change": "Column; card 342x506."
    }
  ],
  "constraints": {
    "onePerPage": true
  },
  "measuredFrom": [
    "spec.t1.promo"
  ]
}
