{
  "id": "section.content.article-chapter-index",
  "registryId": "section.content.article-chapter-index",
  "typeId": "content.article-chapter-index",
  "version": "1.1.0",
  "category": "content",
  "semantic": {
    "id": "semantic.content.article-chapter-index",
    "category": "content"
  },
  "source": {
    "id": "source.jsx.conv.article",
    "tag": "clone-component",
    "citation": "jsx.conv.article",
    "file": "src/components/content/ConversationArticle.jsx",
    "lines": "71-110"
  },
  "retrievalEligible": true,
  "purpose": "Conversation article 'Chapters' index: time-stamped anchor links, one per transcript chapter (each target is the chapter H2 of a content.transcript-chapter).",
  "evidenceLevel": "measured",
  "variants": {
    "standard": "800 column block with block H2 and a link list."
  },
  "composes": [
    "primitive.link",
    "primitive.text"
  ],
  "contentModel": {
    "type": "object",
    "properties": {
      "chapters": {
        "type": "array",
        "items": {
          "type": "object",
          "properties": {
            "time": {
              "type": "string",
              "maxWords": 1,
              "pattern": "^[0-9]{1,2}:[0-5][0-9]$"
            },
            "title": {
              "type": "string",
              "maxWords": 12
            }
          },
          "required": [
            "time",
            "title"
          ],
          "additionalProperties": false
        },
        "minItems": 3,
        "maxItems": 20
      }
    },
    "required": [
      "chapters"
    ],
    "additionalProperties": false
  },
  "motion": {
    "allowedPatterns": [
      "none"
    ],
    "reducedMotionFallbackRequired": true,
    "allowedFields": [
      "pattern",
      "reducedMotionFallback",
      "delayMs"
    ]
  },
  "responsive": [
    {
      "at": "{foundation.breakpoint.phone-max}",
      "change": "Block H2 24/28.8."
    }
  ],
  "constraints": {
    "onePerPage": true
  },
  "measuredFrom": [
    "spec.t3",
    "jsx.conv.article"
  ]
}
