{
  "id": "section.content.legal-section",
  "registryId": "section.content.legal-section",
  "typeId": "content.legal-section",
  "version": "1.1.0",
  "category": "content",
  "semantic": {
    "id": "semantic.content.legal-section",
    "category": "content"
  },
  "source": {
    "id": "source.jsx.legal",
    "tag": "clone-component",
    "citation": "jsx.legal",
    "file": "src/components/content/LegalPage.jsx",
    "lines": "86-113"
  },
  "retrievalEligible": true,
  "purpose": "One heading-bounded part of a legal document: an optional heading (absent only for the unheaded preamble) and its rich-text blocks. Repeated once per top-level heading of the document. Headings are real; ALL body prose is placeholder (structure + word counts only) and must never be generated as legal text.",
  "evidenceLevel": "measured",
  "variants": {
    "terms": "Numbered ol>li>h2 headings + Feature Deck h2s; the Data Processing Agreement and appendices are their own parts; the last part ends with 'Previous terms' live links.",
    "privacy": "Instrument Sans 700 36/43.2 h2s, Feature Deck h3s, blue privacy@ mail link."
  },
  "composes": [
    "primitive.text",
    "primitive.link"
  ],
  "contentModel": {
    "type": "object",
    "properties": {
      "heading": {
        "type": "string",
        "maxWords": 12
      },
      "blocks": {
        "type": "array",
        "items": {
          "type": "object",
          "properties": {
            "kind": {
              "enum": [
                "heading",
                "paragraph",
                "list"
              ]
            },
            "text": {
              "type": "string",
              "maxWords": 12
            },
            "body": {
              "type": "object",
              "properties": {
                "text": {
                  "type": "string",
                  "maxWords": 900
                },
                "copySource": {
                  "enum": [
                    "placeholder"
                  ]
                }
              },
              "required": [
                "text",
                "copySource"
              ],
              "additionalProperties": false
            },
            "items": {
              "type": "array",
              "items": {
                "type": "object",
                "properties": {
                  "text": {
                    "type": "string",
                    "maxWords": 300
                  },
                  "copySource": {
                    "enum": [
                      "placeholder"
                    ]
                  }
                },
                "required": [
                  "text",
                  "copySource"
                ],
                "additionalProperties": false
              },
              "minItems": 1,
              "maxItems": 15
            }
          },
          "required": [
            "kind"
          ],
          "additionalProperties": false
        },
        "minItems": 1,
        "maxItems": 60
      },
      "previousVersions": {
        "type": "array",
        "items": {
          "type": "object",
          "properties": {
            "label": {
              "type": "string",
              "maxWords": 4
            },
            "href": {
              "type": "string",
              "pattern": "^(/[a-z0-9/#-]*|#[a-z0-9-]+|https://[a-zA-Z0-9.-]+(/[^\\s]*)?|mailto:[a-z.]+@siena\\.cx)$"
            }
          },
          "required": [
            "label",
            "href"
          ],
          "additionalProperties": false
        },
        "minItems": 0,
        "maxItems": 3
      }
    },
    "required": [
      "blocks"
    ],
    "additionalProperties": false
  },
  "motion": {
    "allowedPatterns": [
      "none"
    ],
    "reducedMotionFallbackRequired": true,
    "allowedFields": [
      "pattern",
      "reducedMotionFallback",
      "delayMs"
    ]
  },
  "responsive": [
    {
      "at": "{foundation.breakpoint.phone-max}",
      "change": "Padding 96 24 80; body Tiempos 14/21; spacing 18."
    }
  ],
  "constraints": {
    "maxPerPage": 30
  },
  "measuredFrom": [
    "spec.t4",
    "jsx.legal",
    "jsx.legal.body",
    "jsx.legaldata",
    "spec.content.legaltype"
  ],
  "copyPolicy": {
    "blocks[].body/items": "placeholder only - real legal text must come from Siena counsel, never from a generator"
  }
}
